<?xml version="1.0" encoding="UTF-8"?>
<!--<?xml-stylesheet type="text/css" href="Books.css" ?>-->
<?xml-stylesheet type="text/xsl" href="Books.xsl"?>
<b:books xmlns:b="http://www.teachmeskills.by/books1"
  xmlns:xsi="http://www.w3.org/2001/XMLSchema-instance"
  xsi:schemaLocation="http://www.teachmeskills.by/books1 Books.xsd">
<book id="01">
  <title>The Little Prince</title>
  <year>1943</year>
  <genre>Novella</genre>
  <author>
    <name>Antoine de Saint-Exupery</name>
    <year>1900</year>
    <place>France</place>
  </author>
  <price>500</price>
</book>
<book id="02">
  <title>A Tale of Two Cities</title>
  <year>1859</year>
  <genre>Historical fiction</genre>
  <author>
    <name>Charles Dickens</name>
    <year>1812</year>
    <place>England</place>
  </author>
  <price>420</price>
</book>
<book id="03">
    <title>Harry Potter and the Philosopher's Stone</title>
    <year>1997</year>
    <genre>Fantasy</genre>
    <author>
      <name>J. K. Rowling</name>
      <year>1965</year>
      <place>England</place>
    </author>
  <price>150</price>
</book>
  <book id="04">
    <title>And Then There Were None</title>
    <year>1939</year>
    <genre>Mystery</genre>
    <author>
      <name>Agatha Christie</name>
      <year>1890</year>
      <place>England</place>
    </author>
    <price>250</price>
  </book>
  <book id="05">
    <title>Dream of the Red Chamber</title>
    <year>1791</year>
    <genre>Family saga</genre>
    <author>
      <name>Cao Xueqin</name>
      <year>1710</year>
      <place>China</place>
    </author>
    <price>100</price>
  </book>
</b:books>